0,1,2,3,4,5
В XVII в территория Российского государства расширилась за счёт присоединения,Карелии Эстляндии,Восточной Грузии и Восточной Армении,Северного Причерноморья,Левобережной Украины,4
Прочтите отрывок из обращения к народу нижегородского старосты и укажите с каким событием в истории России оно связано,Смута,нашествие Тимура,агрессия крестоносцев,Ливонская война,1
К царствованию Александра I относится,начало работы земств,основание военных поселений,начало промышленного переворота,присоединение Средней Азии,2
С эпохой дворцовых переворотов связано появление понятия,опричнина,зубатовщина,верховники,пугачёвщина,3
В результате польского восстания 1830 1831 гг,Польша получила независимость,польский язык перестал быть государственным,упразднена конституция Царства Польского,расширена автономия Польши в составе России,3
Государственным деятелем эпохи царствования Александра II был,Витте,Сперанский,Кочубей,Лорис Меликов,4
В период нэпа,была отменена государственная монополия внешней торговли,осуществлялась политика форсированной индустриализации,была провозглашена свобода торговли,земля и её недра были переданы в частную собственность,3
К завершающему этапу Великой Отечественной войны 1944 1945 гг относится,Курская битва,битва за Днепр,Висло Одерская операция,Харьковское сражение,3
Что из названного характеризует внешнюю политику российского руководства в начале XXI в,постоянное участие Президента России в работе большой восьмёрки,принятие Россией помощи по плану Маршалла,выдвижение Программы Мира,присоединение России к программе Партнёрство во имя мира,1
Как назывался сборник законов Древнерусского государства,Повесть временных лет,Русская Правда,Соборное уложение,Судебник,2
Общерусские походы против половцев в начале XII в возглавлял князь,Андрей Боголюбский,Дмитрий Донской,Владимир Мономах,Александр Невский,3
Какое из перечисленных событий привело к церковному расколу в XVII в,учреждение патриаршества в России,секуляризация церковных земель,реформа патриарха Никона,противостояние иосифлян и нестяжателей,3
Какой из названных храмов является памятником древнерусского зодчества XII в,Архангельский собор Московского Кремля,церковь Покрова на Нерли,церковь Вознесения в селе Коломенском,собор Василия Блаженного в Москве,2
Современником Екатерины II был,Александр Суворов,Иван Фёдоров,Алексей Адашев,Андрей Курбский,1
Усиление влияния России в Европе в годы царствования Александра I было достигнуто в результате,завершения Заграничного похода русской армии капитуляции Франции,завоевания Россией выхода к Чёрному морю,военных успехов России в годы Семилетней войны,включения в состав Российского государства Правобережной Украины,1
Отмена временнообязанного состояния крестьян разработка фабричного законодательства издание циркуляра о кухаркиных детях ограничение прав земств всё это относится к царствованию,Александра III,Александра II,Николая I,Александра I,1
Какое событие произошло в годы Первой мировой войны,Цусимское сражение,Брусиловский прорыв,оборона Порт Артура,оборона Шипки,2
Кто из названных учёных начала XX в был основоположником ракетостроения,Циолковский,Вернадский,Мечников,Павлов,1
Что стало первым шагом новой экономической политики,денационализация промышленности,принятие плана ГОЭЛРО,введение тарифной системы оплаты труда,замена продовольственной развёрстки продовольственным налогом,4
Экономическая политика в СССР в 1930 е гг характеризовалась,широкой сферой действия рыночных механизмов,созданием фермерских хозяйств,преимущественным развитием тяжёлой промышленности,децентрализацией экономики,3
Кто из названных лиц были выдающимися советскими военачальниками в годы Великой Отечественной войны,Молотов Громыко,Конев Рокоссовский,Каменев Калинин,Троцкий Бухарин,2
Какое событие произошло раньше остальных,начало массового освоения целины,принятие Закона Об индивидуальной трудовой деятельности,принятие конституции развитого социализма,вынесение приговора по ленинградскому делу,4
Что явилось одним из результатов деятельности XIX Всесоюзной партийной конференции 1988 г,принятие программы партии поставившей задачу создания материально технической базы коммунизма в СССР,разгром антипартийной группы Маленкова Молотова Кагановича и примкнувшего к ним Шепилова,решение о созыве Съезда народных депутатов СССР,принятие курса на ускорение социально экономического развития страны,3
В каком ряду названы кинофильмы режиссёра Эйзенштейна,Трактористы Богатая невеста,Чапаев Волочаевские дни,Броненосец Потёмкин Александр Невский,Весёлые ребята Светлый путь,3
В ходе экономических реформ начала 1990 х гг,был принят Закон О кооперации в СССР,была реализована программа 500 дней,был провозглашён курс на ускорение социально экономического развития страны,был принят Закон О приватизации государственных и муниципальных предприятий в РСФСР,4
Какой город после его присоединения к Москве в XV в лишился веча и посадника,Новгород Великий,Тверь,Смоленск,Астрахань,1
Против кого сражалась русская рать в Невской битве в 1240 г,монголов,половцев,шведов,хазар,3
Следствием преобразований проведённых в период регентства Елены Глинской было,создание стрелецкого войска,ограничение местничества,введение общерусской денежной единицы серебряной копейки,учреждение приказной системы управления,3
Какое произведение XVI в излагало религиозные наставления правила семейных отношений и давало хозяйственные рекомендации,Домострой,Поучение детям,Задонщина,Юности честное зерцало,1
Какая из форм организации промышленного производства появилась в России в XVII в,мануфактуры,промыслы,монополии,фабрики,1
Как называлась военная операция в результате которой в сентябре 1812 г русская армия после оставления Москвы смогла оторваться от преследования французов и заняла позиции в укреплённом лагере,Тарутинский марш манёвр,сражение под селом Красным,параллельное преследование французских войск,сражение у реки Березины,1
Следствием разделов Речи Посполитой стало а,вхождение в состав России балтийского побережья от Гданьска до Выборга,передача России Левобережной Украины и Киева,создание антироссийской коалиции в составе Австрии и Пруссии,присоединение к России Западной Белоруссии и Западной Украины,4
Аграрная реформа Столыпина предполагала,национализацию части помещичьей земли,ограничение политики переселения крестьян,развитие общинного землевладения,образование отрубов и хуторских хозяйств,4
Что из перечисленного было одним из следствий Великих реформ 1860 1870 х гг в России,учреждение центрального всесословного законосовещательного органа,создание системы всесословных выборных органов местного самоуправления,создание министерств,установление в стране конституционного строя,2
Руководителем первой русской экспедиции открывшей в 1820 г Антарктиду и 29 островов в Атлантическом и Тихом океанах был,Миклухо Маклай,Пржевальский,Беллинсгаузен,Беринг,3
Что из перечисленного относится к периоду известному под названием полоса признания СССР,создание Коминтерна,подписание советско германского договора о ненападении и секретного протокола к нему,исключение СССР из Лиги Наций,установление дипломатических отношений с Великобританией и Францией,4
Что было одной из причин предпосылок образования СССР,начало массовой коллективизации,существование экономических связей между территориями бывшей Российской империи,результаты референдума о создании СССР,заключение Брест Литовского мирного договора,2
Какое событие способствовало поддержанию морального духа советских воинов в ходе Московской битвы,трансляция исполнения Седьмой симфонии Шостаковича в блокадном Ленинграде,первый победный салют в Москве,проведение традиционного военного парада на Красной площади,открытие Второго фронта в Западной Европе,3
Какой орган власти был создан в период перестройки,Федеральное Собрание,Государственная Дума,Верховный Совет СССР,Съезд народных депутатов,4
Что явилось одним из итогов восьмой пятилетки развития народного хозяйства СССР 1966 1970 гг,открытие первой очереди Московского метрополитена,ввод в действие тракторных заводов в городах Волгограде Челябинске Харькове,восстановление Днепрогэса,ввод в действие первой очереди Волжского автомобильного завода в г Тольятти,4
Кто из перечисленных лиц занимал должность Председателя Правительства РФ в период президентства Ельцина,Рыжков,Зубков,Медведев,Кириенко,4
Кто из московских князей первым получил право сбора дани в пользу Орды со всех русских земель,Юрий Долгорукий,Иван Калита,Василий II Тёмный,Андрей Боголюбский,2
Новым явлением в экономике России XVII в стало,появление мануфактур,появление заводов,появление фабрик,развитие цехового производства,1
Что из перечисленного было следствием набегов половцев во второй половине XI в,миграция населения из Среднего Поднепровья в Волжско Окский район,установление военного союза Руси с Хазарским каганатом,полное прекращение княжеских междоусобиц,установление военного союза Руси с Великим княжеством Литовским,1
Важнейшим явлением российской культуры XVI в стало начало,деревянного зодчества,книгопечатания,иконописи,каменного зодчества,2
Созданные Петром I коллегии постепенно заменили собой,министерства,земства,приказы,вече,3
Одним из направлений внешней политики России в первой четверти XVIII в являлась борьба за,Волжский торговый путь,выход в Балтийское море,Левобережную Украину,освобождение от ордынского владычества,2
Вследствие катастрофической нехватки денег Екатерина II была вынуждена,ввести подушное налогообложение,учредить купеческие гильдии,впервые прибегнуть к внешним займам,создать Вольное экономическое общество,3
Аграрная реформа Столыпина предполагала,передачу всей помещичьей земли крестьянам,ликвидацию частной собственности на землю,ограничение политики переселения крестьян,образование отрубных и хуторских крестьянских хозяйств,4
A M Горчаков разослал циркулярную ноту уведомляя что Россия не считает себя связанной обязательствами Парижского договора 1856 г воспользовавшись,поражением Франции во франко прусской войне,колониальным конфликтом Франции и Англии,восстаниями в колониях Французской империи,сближением с Англией и Францией приведшим к созданию Антанты,1
Что было одной из характерных черт развития культуры в России в первой трети XIX в,проведение Русских сезонов в Париже,расцвет усадебной культуры культуры дворянских гнёзд,расцвет творчества передвижников,деятельность объединения Мир искусства мирискуссников,2
Следствием массовых крестьянских восстаний 1920 1921 гг стало,создание комбедов,начало проведения массовой коллективизации,введение продналога,введение продразвёрстки,3
Крупнейшее в истории танковое сражение у деревни Прохоровка состоялось в ходе,подготовка к форсированию Днепра,битвы под Москвой,Курской битвы,операции по освобождению Белоруссии,3
Заключительный акт Совещания по безопасности и сотрудничеству в Европе был подписан в годы руководства СССР,Хрущёва,Горбачёва,Сталина,Брежнева,4
Что явилось одним из последствий массовой амнистии проведённой в марте 1953 г,фабрикация дела врачей,выход на свободу большинства политических заключённых,рост преступности в стране,новая волна массовых репрессий,3
Кто из перечисленных лиц являлся Премьер министром России в период первого президентского срока Путина,B C Черномырдин,Кириенко,Примаков,Фрадков,4
Какой город после его присоединения к Москве в XV в лишился веча и посадника,Тверь,Астрахань,Смоленск,Новгород Великий,4
Новым явлением в экономике России XVII в стало,появление фабрик,развитие цехового производства,появление заводов,появление мануфактур,4
Какое из произведений древнерусской литературы повествует о Куликовской битве,Слово о полку Игореве,Задонщина,Русская Правда,Повесть временных лет,2
Кто из названных деятелей был сподвижником Петра I,Бирон,Лефорт,Шувалов,Потёмкин,2
Как называлась военная операция в результате которой в сентябре 1812 г русская армия после оставления Москвы смогла оторваться от преследования французов и заняла позиции в укреплённом лагере,сражение под селом Красным,Тарутинский марш манёвр,параллельное преследование французских войск,сражение у реки Березины,2
Вследствие катастрофической нехватки денег Екатерина II была вынуждена,ввести подушное налогообложение,впервые прибегнуть к внешним займам,создать Вольное экономическое общество,учредить купеческие гильдии,2
Отмена временнообязанного состояния крестьян разработка фабричного законодательства издание циркуляра о кухаркиных детях ограничение прав земств всё это относится к царствованию,Александра I,Александра III,Николая I,Александра II,2
Что из перечисленного явилось следствием поражения России в Крымской войне,потеря Россией Севастополя,установление нейтрального режима Чёрного моря,создание Союза трёх императоров,создание Священного союза,2
Кто из названных учёных начала XX в был основоположником ракетостроения,Вернадский,Павлов,Циолковский,Мечников,3
Что стало первым шагом новой экономической политики,введение тарифной системы оплаты труда,принятие плана ГОЭЛРО,замена продовольственной развёрстки продовольственным налогом,денационализация промышленности,3
Что было одной из причин предпосылок образования СССР,существование экономических связей между территориями бывшей Российской империи,начало массовой коллективизации,результаты референдума о создании СССР,заключение Брест Литовского мирного договора,1
Какое событие произошло ранее других,освобождение Киева от фашистов,освобождение Орла от фашистов,начало контрнаступления Красной армии под Сталинградом,танковое сражение у д Прохоровки,3
Какой орган власти был создан в период перестройки,Съезд народных депутатов,Государственная Дума,Федеральное Собрание,Верховный Совет СССР,1
Что явилось одним из последствий массовой амнистии проведённой в марте 1953 г,фабрикация дела врачей,новая волна массовых репрессий,рост преступности в стране,выход на свободу большинства политических заключённых,3
Какое событие относится к периоду застоя,высылка Солженицына из страны,издание постановления Оргбюро ЦК ВКП б о журналах Звезда и Ленинград,издание постановления Оргбюро ЦК ВКП б о кинофильме Большая жизнь,отказ Пастернака от Нобелевской премии по литературе,1
