0,1,2,3,4,5
Совещательный орган при императоре в начале XX в,Сенат,Государственный совет,Консилия министров,Верховный тайный совет,2
Министр внутренних дел с 1904 г либерал автор проекта О мерах к усовершенствованию государственного порядка,Лорис Меликов,Святополк Мирский,Милюков,Витте,2
Какое из названных событий произошло 27 января 1904 г,подрыв флагманского корабля Петропавловск,высадка японских войск на Ляодунском полуострове,героический бой Варяга и Корейца,заключение Портсмутского мирного договора,3
Что из названного относится к результатам первой российской революции,появление многопартийности,формирование конституционной монархии,ликвидация сословного строя,введение рабочего контроля за производством,1
Для выхода из экономического кризиса вызванного Первой мировой войной российское правительство в конце 1916 г,ввело 8 часовой рабочий день в промышленности,ликвидировало помещичье землевладение,отменило выкупные платежи,ввело продовольственную разверстку,4
Творчество поэтов Гумилева Ахматовой Мандельштама в начале XX в относят к,акмеизму,футуризму,импрессионизму,реализму,1
Самое многочисленное сословие Российской империи,мещане,казачество,крестьянство,разночинцы,3
Усиление позиций России в Китае вызывало в первую очередь недовольство,США,Японии,Великобритании,Германии,2
Какое из названных событий произошло раньше других,восстание на броненосце Князь Потемкин Таврический,восстание на крейсере Очаков,стачка текстильщиков в Иваново Вознесенске,созыв первой Государственной думы,3
Отметьте о ком идет речь Дворянин политический деятель лидер октябристов Один из основателей партии Союз 17 октября Депутат а затем председатель III и IV Государственной думы,Столыпин,Милюков,Родзянко,Львов,3
Аграрная реформа Столыпина предусматривала,ликвидацию помещичьего землевладения,социализацию земли,создание частных крестьянских хозяйств,национализацию земли,3
Какое из перечисленных событий Первой мировой войны произошло в 1914 г,наступление русских войск в Галиции,отступление русских войск из Пруссии,наступление русских войск на Юго Восточном фронте,сдача противнику Риги,1
Какие из перечисленных требований были характерны для либеральных партий оформившихся в России в 1905 г,введение демократических свобод принципа разделения властей и решение земельного вопроса путем частичного отчуждения помещичьих земель,сохранение общинного существования и основ самодержавного строя решение рабочего вопроса путем создания системы социального страхования,провозглашение демократических свобод уничтожение самодержавного строя отмена выкупных платежей и национализация земли,провозглашение демократических свобод ликвидация самодержавия и социализация земли,1
Кто из названных ученых является создателем учения о ноосфере,Сеченов,Павлов,Жуковский,Вернадский,4
Название этого направления в поэзии происходит от греческого слова означающего высшую степень чего либо цветущую силу Это,акмеизм,футуризм,символизм,импрессионизм,1
Самый экономически могущественный класс российского общества в начале XX в,рабочий класс,буржуазия,интеллигенция,дворянство,2
Кто из названных государственных деятелей был сторонником экономического привлечения иностранных инвестиций и политического реформирования Российской империи,Витте,Плеве,Святополк Мирский,Путилов,1
Командующий русской сухопутной армией в русско японской войне 1904 1905 гг,Куропаткин,Рожественский,Кондратенко,Макаров,1
Слова Вам нужны великие потрясения нам нужна великая Россия принадлежат,Ленину,Столыпину,Витте,Милюкову,2
Что из названного было одной из целей России в Первой мировой войне,усиление влияния на Балканах,стремление расширить влияние в Юго Восточной Европе,усиление влияния в Манчьжурии,расширение территорий на Кавказе,1
За немедленное заключение демократического мира со всеми воюющими державами выступили,большевики,эсеры,кадеты,черносотенцы,1
Отметьте знаменитых актеров немого кино начала XX в,Голубкина и Скрябин,Шаляпин и Нежданова,Холодная и Мозжухин,Комиссаржевская и Немирович Данченко,3
В каком ряду названы поэты символисты,Блок Брюсов,Хлебников Маяковский,Гумилев Мандельштам,Есенин Клюев,1
По инициативе начальника Московского охранного отделения Зубатова были созданы,церковно приходские школы,легальные рабочие организации,подпольные политические организации,охранные отделения в полиции,2
Требования подготовки и осуществления пролетарской революции установления диктатуры пролетариата и построения социалистического общества содержались в программе,РСДРП,партии кадетов,неонародников,черносотенцев,1
Что из названного было одной из причин революции 1905 г,крестьянское малоземелье,сохранение сословного строя,недовольство крестьян общинными порядками,попытки государства ускорить разрушение общины,1
Участок земли выделенный крестьянину при выходе из общины с сохранением его двора в деревне назывался,хутором,отрубом,артелью,отрезком,2
Какое из названных событий произошло 1 августа 1914 г,Брусиловский прорыв,назначение верховным главнокомандующим императора Николая II,Германия объявила войну России,в Сербии был убит австрийский наследник,3
Кто из названных русских художников конца XIX начала XX в не входил в творческое общество Мир искусства,Бенуа,Сомов,Рерих,Коровин,4
В каком ряду перечислены имена талантливых крестьянских поэтов начала XX в,Бальмонт Блок Брюсов,Есенин Клюев Клычков,Гумилев Ахматова Мандельштам,Хлебников Бурлюк Крученых,2
Требования свержения самодержавия социализации земли установления народовластия и федеративного государства содержались в программе партии,большевиков,меньшевиков,кадетов,эсеров,4
Что из названного является одним из результатов революции 1905 1907 гг,создание конституционной монархии,ликвидация помещичьего землевладения,отмена выкупных платежей,введение 8 часового рабочего дня на предприятиях,3
Отметьте о ком идет речь Родился в обедневшей дворянской семье В 1889 г окончил юридический факультет Петербургского университета Отказавшись от профессорской карьеры в 1890 г поступил на службу в Министерство финансов а в 1905 г стал управляющим Крестьянским и Дворянским земельными банками В 1906 г перешел на службу в частные банки стал крупным финансистом и промышленником директор Русско Азиатского банка член правления акционерного общества Промет ряда заводов железных дорог и речных пароходств,Третьяков,Путилов,Гучков,Морозов,2
Какое из названных событий произошло в ходе кампании 1915 г,удачное наступление на фронте русских войск под командованием Брусилова,русская армия оставила Галицию польские земли входившие в состав империи часть Белоруссии,поражение русских армий под командованием Самсонова в Восточной Пруссии,взятие русской армией Эрзерума и Трапезунда,2
Что из названного характеризует реформы Столыпина,ограничение помещичьего землевладения,разработка проекта укрепления общинного землепользования,отмена сословий,разрушение общины,4
Архитектор внесший огромный вклад в развитие русского московского модерна,Коненков,Шехтель,Жолтовский,Воронихин,2
Художник автор картины Заседание Государственного совета,Бенуа,Рерих,Коровин,Репин,4
В состав Совнаркома с ноября 1917 г по март 1918 г входили представители партий,большевиков и меньшевиков интернационалистов,большевиков и левых эсеров,большевиков и правых эсеров,большевиков и кадетов,2
Высший орган власти в России в марте октябре 1917 г,Временное правительство,Петроградский совет,съезд Советов,Учредительное собрание,1
Что из названного характеризует политику военного коммунизма,введение демократических свобод для всех категорий населения,введение натурального обмена при отмене свободной торговли,денационализация крупных предприятий,разрешение деятельности частных банков,2
Определите одну из причин обусловивших победу большевиков в Гражданской войне,политика военного коммунизма,введение всеобщих демократических прав и свобод,поддержка крестьянством советской власти,пропаганда идей справедливого государства для трудового народа,1
За создание однородного социалистического правительства летом 1917 г Выступал,Гучков,Милюков,Ленин,Мартов,4
Какое из названных событий произошло в конце мая 1918 г,мятеж левых эсеров в Москве,мятеж Чехословацкого корпуса,мятеж юнкеров в Москве,восстание на броненосце Князь Потемкин Таврический,2
Первая Конная армия была создана для борьбы,с войсками Колчака,с войсками Деникина,с войсками Юденича,с войсками Врангеля,2
Кто из названных деятелей революции назвал разгон Учредительного собрания открытым явным грубым,Троцкий,Свердлов,Спиридонова,Чернов,4
Отметьте одно из положений деникинского проекта земельной реформы,частная собственность на землю,введение продовольственной диктатуры,введение института временнообязанных крестьян,передача земли общине,1
Отметьте самый популярный лозунг в российском обществе осенью 1917 г,Вся власть Учредительному собранию,Вся власть Советам,Землю крестьянам,Долой министров капиталистов,1
Военное вмешательство иностранных государств во внутренние дела другого государства называется,экспроприацией,интервенцией,эскалацией,аннексией,2
Комуч был создан из,бывших членов Учредительного собрания,офицеров чехословацкого корпуса,сторонников адмирала Колчака,бывших членов Временного правительства,1
Одной из причин Гражданской войны в России было недовольство части населения,свержением монархической власти,политикой диктатуры пролетариата,начавшейся интервенцией,Декретом о земле,2
Кто из названных военачальников был командармом Первой Конной армии,Ворошилов,Буденный,Фрунзе,Тухачевский,2
Высший орган государственной власти после Октября 1917 г,Учредительное собрание,Верховный Совет,Совет Народных Комиссаров,Всероссийский съезд Советов рабочих и солдатских депутатов,4
Что из названного является одной из причин Гражданской войны,недовольство диктатурой пролетариата,принятие первой Конституции,вмешательство иностранных государств,исключение меньшевиков и правых эсеров из состава ВЦИК,1
Кто из перечисленных участников Гражданской войны возглавлял анархо крестьянское движение на Украине,Чапаев,Котовский,Махно,Щорс,3
По закону о социализации земля была передана,крестьянской общине,в собственность государства,в частную собственность крестьян,в собственность земств,2
Продразверстка это,монополия государства на производство и продажу хлеба,норма сдачи хлеба государству,всеобщая трудовая повинность,дневная норма рабочего,2
Кто из названных руководителей белого движения встал во главе Добровольческой армии созданной на Дону в конце 1917г,Врангель,Каледин,Колчак,Корнилов,4
Что из названного является целью создания комитетов бедноты в 1918 г,контроль пролетариата за производством на мелких и средних промышленных предприятиях,помощь продовольственным отрядам реквизировать хлеб у крестьян,создание системы образования на селе,помощь местным органам советской власти в проведении мобилизации в Красную армию,2
Что из названного является одной из причин революционных событий в феврале 1917 г,деятельность Государственной думы,дестабилизирующее влияние войны на экономическое и политическое развитие страны,принятие Николаем II командования войсками,активная деятельность земств против самодержавия,2
Какое событие произошло раньше других,расстрел демонстрации в Петрограде,создание Временного правительства,созыв I съезда Советов рабочих и солдатских депутатов,Корниловский мятеж,2
Что из названного было характерно для национальной политики Временного правительства,восстановление автономии Финляндии,провозглашение автономного правления в Польше,признание права национальных окраин на самоопределение вплоть до отделения от Российского государства,разрешение национальным окраинам разрабатывать свои конституции,1
Какое из названных событий произошло 14 сентября 1917 г,Корнилов предпринял наступление на Петроград,открылся I съезд Советов рабочих и солдатских депутатов,начались сепаратные переговоры с Германией,приступило к работе Демократическое совещание в Петрограде,4
Для борьбы с контрреволюцией и саботажем советская власть создала,ГОЭЛР,комбеды,ВСНХ,ВЧК,4
Какое из названных событий произошло в июле 1918 г,наступление Добровольческой армии на Москву,принятие Декрета о земле,покушение на Ленина,принятие Конституции РСФСР,4
Насильственное присоединение территории другого государства это,аннексия,контрибуция,репарация,репатриация,1
Укажите одну из причин поражения Белого движения в Гражданской войне,слабое финансовое обеспечение войск,низкий профессиональный уровень солдат и офицеров,требование восстановить единую и неделимую территорию Российской империи,политика военного коммунизма,3
Омский диктатор расстрелянный красными в 1920 г,Дутов,Врангель,Колчак,Деникин,3
Декрет о мире содержал следующее положение,возвращение к довоенным границам воюющих государств,денежная компенсация Германии за согласие заключить мир,необходимость усиления позиций Антанты и принуждение Германии подписать мир,заключение мира любой ценой,1
II Всероссийский съезд Советов принял,Декларацию прав трудящегося и эксплуатируемого народа,Декрет об уничтожении сословий и гражданских чинов,Декрет о земле,Конституцию РСФСР,3
Командующий корпусом пытавшийся оказать поддержку Керенскому в походе на Петроград в октябре 1917 г,Краснов,Деникин,Корнилов,Врангель,1
Партия или общественная группа выступающая против мнения большинства или господствующей точки зрения выдвигающая иное решение существующих проблем называется,олигархической,коалиционной,сепаратистской,оппозиционной,4
В мае июне 1919 г началось крупномасштабное наступление войск под командованием,Деникина,Юденича,Колчака,Врангеля,1
Что из названного послужило поводом к официальному объявлению красного террора,сопротивление крестьян продовольственным отрядам,убийство немецкого посла Мирбаха,покушение на жизнь Ленина,начало интервенции,3
Что из названного является одной из причин иностранной военной интервенции,национализация помещичьей земли,отказ советского правительства от выплаты царских долгов,установление продовольственной диктатуры,стремление поддержать Чехословацкий корпус,2
Председателем Петроградского Совета в сентябре 1917 г был избран,Сталин,Троцкий,Бухарин,Ленин,2
