0,1,2,3,4,5
Какое море соединяется с Мраморным проливом Босфор,Адриатическое,Черное,Эгейское,Средиземное,2
Среди какого народа долго жил Миклухо Маклай,Маори,Алеуты,Папуасы,Самоанцы,3
Как звали Чацкого из Горе от ума,Александр Андреевич,Алексей Андреевич,Александр Сергеевич,Андрей Александрович,1
В каком городе находится мечеть с самым высоким в мире минаретом,Касабланка,Стамбул,Мекка,Джакарта,1
Какой советский космический корабль в 1975 году пристыковался к американскому Аполлону,Восток 6,Восход 2,Прогресс 8,Союз 19,4
В какой стране расположен город Антверпен,Нидерланды,Дания,Германия,Бельгия,4
Чем скрепляются между собой различные металлические элементы Эйфелевой башни,заклёпками,болтами,сварными швами,шурупами саморезами,1
Что в 1966 году открыли Советские ученые в Антарктике на глубине трех километров,Затонувший корабль,Огромный метеорит,Пресное озеро,Залежи урана,3
Какой плод на латыни называется армянской сливой,алыча,персик,абрикос,айва,3
Раньше в примитивных светильниках использовалось деревянное масло Что это за масло,Подсолнечное,Льняное,Оливковое,Рыбий жир,3
В какой стране в 1960 году Сиримаво Бандаранаике стала первой женщиной премьер министром,Шри Ланка,Малайзия,Тайланд,Пакистан,1
Полуостров разделяющий моря Карское и Лаптевых,Атолл,Новая Земля,Сахалин,Таймыр,4
Сколько попыток в самом начале игры даётся игроку в боулинг чтобы сбить 10 кеглей,Одна,Две,Три,Четыре,2
Какой хореограф более 30 лет сотрудничал с композитором Игорем Стравинским,Майа Плисецкая,Михаил Барышников,Марта Грэм,Джордж Баланчин,4
Какой из легковых автомобилей производившихся в бывших соц странах был фактически советской Победой,Варшава,Дачиа,Застава,Трабант,1
Как зовут главных героев повести Ночевала тучка золотая Приставкина,Саша и Петя,Саша и Вася,Саша и Коля,Саша и Ваня,3
Чьими снами интересовались поэт Михаил Матусовский и композитор Владимир Шаинский в совместной песне,Медного всадника,Исаакиевского собора,Ростральной колонны,Крейсера Аврора,4
В чьи обязанности вxодит указывать крановщику как поднимать и куда доставлять груз,Кровельщик,Каменщик,Плановик,Такелажник,4
Кто от имени советского Верховного Главнокомандования принял капитуляцию фашистской Германии,Жуков,Рокосовский,Конев,Молотов,1
В каком городе происходит действие фильма Асса,Алушта,Сочи,Кисловодск,Ялта,4
Действие какой из новелл Проспера Мериме протекает на Корсике,Таманго,Партия в триктрак,Маттео Фальконе,Этрусская ваза,3
Как в СССР называлась одна из разновидностей лотереи,Старт,Кросс,Ринг,Спринт,4
Кто написал поэму Ода к радости,Мартин Лютер,Иоганн Вольфганг фон Гёте,Генрих Гейне,Фридрих Шиллер,4
Информацию о чём содержит в себе древнеегипетский папирус Ринда,Математика,Политика,Религия,Любовь,1
Как зовут самую знаменитую героиню детской писательницы Памелы Трэверс,Пеппи Длинный чулок,Тутта Карлссон,Гермиона Грейнджер,Мэри Поппинс,4
В каком чине был выпущен из лицея Александр Пушкин,Надворный советник,Коллежский секретарь,Коллежский регистратор,Титулярный советник,2
Фирменным спектаклем какого театра является Принцесса Турандот,Ленком,Сатиры,Имени Вахтангова,БДТ,3
Что поручено охранять сотне стражников швейцарской гвардии,штаб квартиру ООН,папу и Ватикан,Букингемский дворец,Белый дом в Вашингтоне,2
Автор романа Триумфальная арка,Ремарк,Дюма,Пикуль,Конан Дойль,1
Какой советский маршал в 1948 году стал министром национальной обороны Польши,Рокоссовский,Малиновский,Жуков,Конев,1
Какой из этих романов написан не кем нибудь из сестер Бронте Шарлоттой Эмили или Анной,Шерли,Агнес Грей,Аргонавты,Грозовой перевал,3
Детективные произведения какого автора почти всегда связаны со скачками и скаковыми лошадьми,Джеймс Чейз,Гордон Диксон,Филипп Дик,Дик Фрэнсис,4
Что можно сделать с помощью постромок,научиться плавать,посеять что либо,запрячь лошадь,повесить картину,3
С какого события начинается летоисчисление древних Греков,С первой олимпиады,Троянская война,Сотворение мира,Основание Афин,1
Рыба вьющая гнезда в заросляx водорослей,Угорь,Осетр,Камбала,Морская колюшка,4
Слово энциклопедия греческого происхождения Что оно означает дословно,Широкий круг сведений,Детский кружок творчества,Фундамент образования,Обучение в полном круге,4
Древнее название этой столицы европейского государства Виндобона,Вадуц,Вильнюс,Лиссабон,Вена,4
Название какого европейского города первоначально означало датский город,Данди,Дюнкерк,Таллин,Гданьск,3
В песне в поётся Что стоишь качаясь тонкая рябина головой склоняясь до самого тына А что такое тын,Задняя стена дома,Крыльцо,Сеновал,Забор,4
Как называлась первая династия франков,Каролинги,Капетинги,Валуа,Меровинги,4
Кого кроме Гамлета играл в народном театре Юрий Деточкин герой фильма Берегись автомобиля,Хлестакова,Чацкого,Онегина,Отелло,2
Какой математический знак указывает на порядок действий,Равно,Интеграл,Скобки,Модуль,3
В каком городе родилась известная актриса Фаина Раневская,Москва,Одесса,Таганрог,Ялта,3
Какой показатель является неизменным в автогонках с 1923 года проходящих около французского города Ла Ман,время,скорость,количество участников,расстояние,1
Здание какого вокзала Москвы спроектировал архитектор Тон автор Оружейной палаты Кремля,Курского,Ленинградского,Киевского,Рижского,2
Как звали следователя из романа Достоевского Преступление и наказание,Перфилий Павлович,Порфирий Павлович,Порфирий Петрович,Перфилий Петрович,3
Кто был первым программистом,Чарльз Беббидж,Блез Паскаль,Ада Байрон,Билл Гейтс,3
Какой остров самый большой по площади в мире,Калимантан,Австралия,Гренландия,Сахалин,3
Сколько кораблей вернулось совершив первое кругосветное плаванье в экспедиции Магеллана в Севилью,Два,Три,Один,Четыре,3
Что драматург Пьер Огюстен Бомарше преподавал дочерям Людовика XV,Литературу,Историю,Музыку,Французский язык,3
Когда возникло первое славянское государственное образование на Балканском п ове Семь славянский племён,5 й век,6 й век,7 й век,8 й век,3
Кто из этих великих художников долго жил на Таити,Сезанн,Дега,Гоген,Матисс,3
Как герой фильма Белорусский вокзал назвал свой батальон,Непромокаемый,Непотопляемый,Непобедимый,Неприступный,1
Под каким именем Эрих Вейсс достиг всемирной славы,Гарри Гудини,Тони Вейсмюллер,Фред,Макс Линдер,1
Самая высокая гора мира,Аконкагуа,Килиманджаро,Мак Кинли,Эверест,4
Какой английский писатель придумал слово лилипут,Даниель Дефо,Уильям Теккерей,Джонатан Свифт,Чарльз Диккенс,3
Какую кличку носил герой Миронова из кинофильма Бриллиантовая рука по сценарию,Граф Геннадий Петрович Козодоев он же Геша,Князь,Барон,Купец,1
В каком городе родился пророк Мухаммед Магомет,Медина,Мекка,Мемфис,Дамаск,2
Что означает немецкое словосочетание крафт тойфель от которого произошло слово картофель,Дьявольская сила,Земляная пища,Чудесный плод,Богатырский дух,1
Кто из русских царей написал свод уставов по соколиной охоте,Иван Грозный,Алексей Михайлович,Пётр I,Пётр III,2
Какое ремесло возрождал в России Михаил Васильевич Ломоносов,Керамику,Литьё,Ковку,Мозаику,4
Как звали мать Родиона Раскольникова,Авдотья Романовна,Марфа Петровна,Лизавета Ивановна,Пульхерия Александровна,4
Какая из пряностей приготавливается из цветочных бутонов,Гвоздика,Горчица,Корица,Тмин,1
Музыку какого композитора Андрей Тарковский использовал в фильме Солярис,Моцарт,Бах,Бетховен,Гендель,2
4 пенса в старину,Гроут,Фартинг,Полукрона,Шиллинг,1
Что такое наргиле,Вид кальяна,Сорт сливы,Арбузный мед,Верблюжья колючка,1
Какой из этих диснеевских мультфильмов был создан раньше остальных,Бемби,Белоснежка и семь гномов,Золушка,Пиноккио,2
Какое из этих старинных орудий имело длинный ствол и применялось для стрельбы на дальние расстояния,Единорог,Кулеврина,Мортира,Пищаль,2
Чем становятся абрикосы высушенные вместе с косточкой,Курагой,Кайсой,Урюком,Сабзой,3
Какова высота футбольных ворот,200 см,244 см 8 футов,264 см,190 см,2
Источником какого металла является минерал киноварь,Вольфрама,Ртути,Железа,Меди,2
Как называют музыканта играющего на сопилке,сопильник,сопилкарь,соплист,сопилюшник,2
Кто забил решающий мяч за сборную Франции в финале чемпионата Европы по футболу 2000 года,Зидан,Анри,Трезеге,Вильторд,3
На какого популярного в начале 70 х певца сочинили эпиграмму Прекрасно быть певцом и со своим лицом,Муслим Магомаев,Эдуард Хиль,Кола Бельды,Иосиф Кобзон,3
Как звали одного из самых колоритных персонажей оперетты Кальмана Принцесса цирка,Баклан,Пеликан,Фламинго,Буревестник,2
В каком стиле работал архитектор Растрелли,Готика,Классицизм,Рококо,Барокко,4
Какой штат наименьший по площади в США,Род Айленд,Канзас,Коннектикут,Делавэр,1
Когда празднуют Всемирный день здоровья,В январе,В августе,В апреле,В ноябре,3
Кто сказал Государство это я,Октавиан Август,Наполеон Бонапарт,Людовик XIV,Борис Березовский,3
В каком заповеднике в 1991 году произошло тайное подписание акта о расформировании СССР,Тебердинский,Беловежская пуща,Шульган Таш,Брянский лес,2
На основе какого напитка готовится коктейль Маргарита,Ром,Водка,Текила,Коньяк,3
Как звучит полное имя главной героини повести Тургенева Ася,Анна,Анастасия,Александра,Ксения,1
Как звучит буквальный перевод с французского юридического термина форс мажор,Внезапное событие,Изменение условий,Непреодолимая сила,Безвыходная ситуация,3
Как называется место для одного локомотива в железнодорожном депо,Стойло,Гараж,Ангар,Сектор,1
Как полиграфисты называют привычную нам форму книги пришедшую на смену древним свиткам,Суффикс,Люрекс,Журфикс,Кодекс,4
Как называется свод условных знаков и пояснений к карте,Легенда,Абрис,Кроки,Кодекс,1
В какой столице состоялся первый конкурс российских красавиц,Петербург,Москва,Париж,Лондон,3
Какая программа Российского телевидения занесена в книгу Рекордов Гиннеса,Очевидное невероятное,В мире животных,Клуб путешественников,Что Где Когда,3
Как называется партизанская война в Испании и Латинской Америке,Герилья,Бандерилья,Сендерилья,Гереро,1
Какой актрисе Нико Пиросмани подарил миллион алых роз,Марлен Дитрих,Вера Холодная,Полина Виардо,Марго Де Севр,4
В какой праздник немец Матиас Руст посадил свой самолет возле Красной площади,День милиции,День чекиста,День пограничника,День авиации,3
Какое из этих слов означает также и род деревьев,Балка,Арка,Остов,Каркас,4
Какой химический элемент обозначается Pb,Золото,Олово,Полоний,Свинец,4
Какой из этих российских придворных чинов был ниже остальных,Камергер,Гофмейстер,Гофмаршал,Шталмейстер,1
Кто из неуловимых мстителей выкрал стратегическую карту из кабинета полковника Кудасова,Данька,Яшка,Ксанка,Валерка,4
Где родилось выражение момент истины,В суде,В церкви,На корриде,На дуэли,3
Какая страна первая потопило судно с помощью торпеды,Россия,Великобритания,Германия,Турция,1
Как ботаник классифицирует растение известное в России как Иван да Марья,Фиалка полевая,Фиалка трехцветная,Фиалка душистая,Фиалка собачья,2
Амплуа династии цирковых артистов Кантемировых,Иллюзионисты,Наездники джигиты,Эквилибристы,Дрессировщики,2
Что является главным компонентом болотного газа,Водород,Метан,Ацетилен,Сероводород,2
Кто автор бессмертной Похвалы Глупости,Эразм Роттердамский,Ларошфуко,Франсуа Рабле,Вольтер,1
Как раньше называлось парусное судно Крузенштерн которое ходит под российским флагом,Пекин,Пассат,Проссейн,Падуя,4
Что в старину означало слово браный,Вытканный с узорами,Имеющий отношение к войне,Обработанный бороной,Богохульный,1
Какое оружие помогло зажечь олимпийский огонь на играх в Барселоне,копьё,винтовка,пистолет,лук,4
Какой породы была тургеневская Муму,Спаниель,Пудель,Болонка,Дворняжка,1
Кто автор высказывания Любите книгу источник знаний,Ленин,Горький,Маяковский,Луначарский,2
Где правит королевский дом Бернадотов,Монако,Англия,Норвегия,Швеция,4
У какого животного коренные зубы могут смениться в течение жизни 6 раз,Слон,Медведь,Зубр,Тигр,1
Чему равна 1 английская кварта,1 136 л,0 142 л,4 546 л,0 568 л,1
Какая техника письма использовалась при написании Моны Лизы Да Винчи,Спретсатура,Сфрегаззи,Серлиано,Сфумато,4
Какая из богинь судьбы в греческой мифологии перерезает нить жизни,Немесида,Атропа,Лахесис,Клото,2
При какой температуре по Цельсию закипает вода на вершине Эвереста,100 градусов,128 градусов,не кипит вообще,68 градусов,4
Как назывался первый атлас всех звезд видимых невооруженным глазом который был издан в 1603 году Иоганном Байером,Космотеория,Небесная сфера,Уранометрия,Светила,3
В каком австрийском городе родился Арнольд Шварценеггер,Зальцбург,Грац,Инсбрук,Линц,2
В каком городе находится ГРАНД ОПЕРА,Вашингтон,Париж,Лондон,Милан,2
Чья шерсть идёт на изготовление мутоновой шубы,Козла,Овцы,Верблюда,Собаки колли,2
Как называется крупнейший в мире алмаз весивший 621 2 грамма,Кох И Нур,Эксцельсиор,Южная Звезда,Куллинан,4
Какая из этих академий имеет статус При правительстве РФ,Естественных наук,Славянской культуры,Народного хозяйства,Театрального искусства,3
Кем приходился Иоанн Безземельный Ричарду Львиное сердце,Сыном,Внуком,Братом,Отцом,3
Из какой басни Крылова пошло выражение Рыльце в пуху,Волк и лисица,Лисица и сурок,Лисица и осёл,Ворона и лисица,2
На борту какого корабля Наполеон сдался англичанам,Джей Мария,Беллерофон,Джустиниан,Конституция,2
Что означает слово цицеро,Типографский шрифт,Минерал,Порода кур,Вид тайнописи,1
Что такое РЕПЕТИР,Механизм часов,Амплуа актёра,Режиссёр театра,Геодезический прибор,1
Какой из президентов США подписал приказ об атомной бомбардировке городов,Эйзенхауэр,Трумэн,Кулидж,Рузвельт,2
Какое из этих озер является источником реки Миссисипи,Итаска,Милле лакс,Миннетонка,Лесное озеро,1
На территории какой современной страны был убит как говорят мореплаватель Джеймс Кук,Папуа Новая Гвинея,Австралия,США,Новая Зеландия,3
Какая российская теннисистка первой одержала победу на турнире Большого Шлема,Анастасия Мыскина,Анна Курникова,Мария Шарапова,Ольга Морозова,1
Что коллекционирует фалерист,Значки,Марки,Конверты,Открытки,1
От каких греческих слов образовано слово гастроном,желудок и любовь,желудок и правда,желудок и вкус,желудок и закон,4
В какой из этих стран сейчас правит королева а не король,Испания,Дания,Швеция,Норвегия,2
Как называются все падежи кроме именительного,Дополнительные,Косвенные,Вспомогательные,Побочные,2
Чему равна одна международная морская миля,1852 м,1814 м,1836 м,1844 м,1
Какая русская мера вместимости для сыпучих тел больше,Четверик,Ведро,Четверть,Гарнец,3
